"country","countryCode","date","filterByKeyword","filterByRating","input","isAmazonVine","isProductPageReviewFromOtherCountry","isVerified","position","product/listPrice","product/price","productAsin","productOriginalAsin","ratingScore","reviewCategoryUrl","reviewDescription","reviewId","reviewImages/0","reviewReaction","reviewTitle","reviewUrl","reviewedIn","totalCategoryRatings","totalCategoryReviews","userId","userProfileLink","variant","variantAsin","variantAttributes/0/key","variantAttributes/0/value","variantAttributes/1/key","variantAttributes/1/value"
"United States",,"2025-05-21",,"allStars","https://www.amazon.com/Print-Shop-5-0-Professional-Impressive/dp/B07WSK3JS5/ref=pd_rhf_ee_s_pd_sbs_rvi_d_sccl_1_20/132-8474279-2690144?pd_rd_w=jBX3v&content-id=amzn1.sym.6640a844-ab24-4352-ac9b-78899e683a5e&pf_rd_p=6640a844-ab24-4352-ac9b-78899e683a5e&pf_rd_r=8PJF5C5K02K4NBQ02YRM&pd_rd_wg=arf7O&pd_rd_r=a4ea5dda-37ce-4956-965f-5c2a68487a3e&pd_rd_i=B07WSK3JS5&th=1","false","false","true","1",,,"B07WSK3JS5","B07WSK3JS5","1",,"The serial key is not right","R3K7QZHTRHHSPG",,,"The product is worthless without the serial code","https://www.amazon.com/gp/customer-reviews/R3K7QZHTRHHSPG/ref=cm_cr_dp_d_rvw_ttl?ie=UTF8&ASIN=B07WSK3JS5","Reviewed in the United States on May 21, 2025",,,"amzn1.account.AGF2CPDMF6TSMXOXWZFQQC24NGPQ","https://www.amazon.com/gp/profile/amzn1.account.AGF2CPDMF6TSMXOXWZFQQC24NGPQ/ref=cm_cr_dp_d_gw_tr?ie=UTF8","Platform: PC Download, Edition: Professional","B07WSK3JS5","Platform","PC Download","Edition","Professional"
"United States",,"2021-07-23",,"allStars","https://www.amazon.com/Print-Shop-5-0-Professional-Impressive/dp/B07WSK3JS5/ref=pd_rhf_ee_s_pd_sbs_rvi_d_sccl_1_20/132-8474279-2690144?pd_rd_w=jBX3v&content-id=amzn1.sym.6640a844-ab24-4352-ac9b-78899e683a5e&pf_rd_p=6640a844-ab24-4352-ac9b-78899e683a5e&pf_rd_r=8PJF5C5K02K4NBQ02YRM&pd_rd_wg=arf7O&pd_rd_r=a4ea5dda-37ce-4956-965f-5c2a68487a3e&pd_rd_i=B07WSK3JS5&th=1","false","false","true","2",,,"B07WSK3JS5","B07WSK3JS5","5",,"Amazing product","R3SQ0FLXPR89BT",,"One person found this helpful","Thanks Amazon","https://www.amazon.com/gp/customer-reviews/R3SQ0FLXPR89BT/ref=cm_cr_dp_d_rvw_ttl?ie=UTF8&ASIN=B07WSK3JS5","Reviewed in the United States on July 23, 2021",,,"amzn1.account.AE2NKYHC246YO6B3JKWO7XAPKOJA","https://www.amazon.com/gp/profile/amzn1.account.AE2NKYHC246YO6B3JKWO7XAPKOJA/ref=cm_cr_dp_d_gw_tr?ie=UTF8","Platform: PC Download, Edition: Professional","B07WSK3JS5","Platform","PC Download","Edition","Professional"
"United States",,"2025-02-25",,"allStars","https://www.amazon.com/Print-Shop-5-0-Professional-Impressive/dp/B07WSK3JS5/ref=pd_rhf_ee_s_pd_sbs_rvi_d_sccl_1_20/132-8474279-2690144?pd_rd_w=jBX3v&content-id=amzn1.sym.6640a844-ab24-4352-ac9b-78899e683a5e&pf_rd_p=6640a844-ab24-4352-ac9b-78899e683a5e&pf_rd_r=8PJF5C5K02K4NBQ02YRM&pd_rd_wg=arf7O&pd_rd_r=a4ea5dda-37ce-4956-965f-5c2a68487a3e&pd_rd_i=B07WSK3JS5&th=1","false","false","true","3",,,"B07WSK3JS5","B07WSK3JS5","1",,"Worst purchase I have ever made. They sent an activation code that never worked nor would they send a new one. Purchased something that I never got a chance to use. It’s not worth buying.","R101GEDUDI66AR",,,"Will not purchase ever again","https://www.amazon.com/gp/customer-reviews/R101GEDUDI66AR/ref=cm_cr_dp_d_rvw_ttl?ie=UTF8&ASIN=B07WSK3JS5","Reviewed in the United States on February 25, 2025",,,"amzn1.account.AGFXXSWV5D6JJ7EYXQ6RA6A2UIYA","https://www.amazon.com/gp/profile/amzn1.account.AGFXXSWV5D6JJ7EYXQ6RA6A2UIYA/ref=cm_cr_dp_d_gw_tr?ie=UTF8","Platform: PC Download, Edition: Professional","B07WSK3JS5","Platform","PC Download","Edition","Professional"
"United States",,"2025-04-17",,"allStars","https://www.amazon.com/Print-Shop-5-0-Professional-Impressive/dp/B07WSK3JS5/ref=pd_rhf_ee_s_pd_sbs_rvi_d_sccl_1_20/132-8474279-2690144?pd_rd_w=jBX3v&content-id=amzn1.sym.6640a844-ab24-4352-ac9b-78899e683a5e&pf_rd_p=6640a844-ab24-4352-ac9b-78899e683a5e&pf_rd_r=8PJF5C5K02K4NBQ02YRM&pd_rd_wg=arf7O&pd_rd_r=a4ea5dda-37ce-4956-965f-5c2a68487a3e&pd_rd_i=B07WSK3JS5&th=1","false","false","true","4",,,"B07WSK3JS5","B07WSK3JS5","3",,"I cannot get this product to activate. I cannot seem to find out how to talk to customer service.  Product key doesn't work.","R2MW052W2Z4AGC",,,"PS5E-M3V2-XWE3-4PNP","https://www.amazon.com/gp/customer-reviews/R2MW052W2Z4AGC/ref=cm_cr_dp_d_rvw_ttl?ie=UTF8&ASIN=B07WSK3JS5","Reviewed in the United States on April 17, 2025",,,"amzn1.account.AGPALTZHRXYDHPM6BJJH7LY2JFVA","https://www.amazon.com/gp/profile/amzn1.account.AGPALTZHRXYDHPM6BJJH7LY2JFVA/ref=cm_cr_dp_d_gw_tr?ie=UTF8","Platform: PC Download, Edition: Professional","B07WSK3JS5","Platform","PC Download","Edition","Professional"
"United States",,"2020-01-12",,"allStars","https://www.amazon.com/Print-Shop-5-0-Professional-Impressive/dp/B07WSK3JS5/ref=pd_rhf_ee_s_pd_sbs_rvi_d_sccl_1_20/132-8474279-2690144?pd_rd_w=jBX3v&content-id=amzn1.sym.6640a844-ab24-4352-ac9b-78899e683a5e&pf_rd_p=6640a844-ab24-4352-ac9b-78899e683a5e&pf_rd_r=8PJF5C5K02K4NBQ02YRM&pd_rd_wg=arf7O&pd_rd_r=a4ea5dda-37ce-4956-965f-5c2a68487a3e&pd_rd_i=B07WSK3JS5&th=1","false","false","true","5",,,"B07WSK3JS5","B07WSK3JS5","5",,"Bought for my mothers boyfriend for his tattoo shop.","R35QTCFY962U6L",,"2 people found this helpful","Stenicils","https://www.amazon.com/gp/customer-reviews/R35QTCFY962U6L/ref=cm_cr_dp_d_rvw_ttl?ie=UTF8&ASIN=B07WSK3JS5","Reviewed in the United States on January 12, 2020",,,"amzn1.account.AHWCW3BTUFXGKPJPHDHVQ7DFSIBQ","https://www.amazon.com/gp/profile/amzn1.account.AHWCW3BTUFXGKPJPHDHVQ7DFSIBQ/ref=cm_cr_dp_d_gw_tr?ie=UTF8","Platform: PC Download, Edition: Professional","B07WSK3JS5","Platform","PC Download","Edition","Professional"
"United States",,"2023-11-06",,"allStars","https://www.amazon.com/Print-Shop-5-0-Professional-Impressive/dp/B07WSK3JS5/ref=pd_rhf_ee_s_pd_sbs_rvi_d_sccl_1_20/132-8474279-2690144?pd_rd_w=jBX3v&content-id=amzn1.sym.6640a844-ab24-4352-ac9b-78899e683a5e&pf_rd_p=6640a844-ab24-4352-ac9b-78899e683a5e&pf_rd_r=8PJF5C5K02K4NBQ02YRM&pd_rd_wg=arf7O&pd_rd_r=a4ea5dda-37ce-4956-965f-5c2a68487a3e&pd_rd_i=B07WSK3JS5&th=1","false","false","true","6",,,"B07WSK3JS5","B07WSK3JS5","1",,"I get an error message when trying to download this product that says it could not be downloaded due to virus scan failed. I have tried everything in suggestions to get this to download with no luck. I would like to receive either a disc so I can download this or get my money back!!!","R1THIC91HFW9XN",,"One person found this helpful","Could not get this product to download","https://www.amazon.com/gp/customer-reviews/R1THIC91HFW9XN/ref=cm_cr_dp_d_rvw_ttl?ie=UTF8&ASIN=B07WSK3JS5","Reviewed in the United States on November 6, 2023",,,"amzn1.account.AHSSB257UGMQKGLZZXJ7OY23ZHQQ","https://www.amazon.com/gp/profile/amzn1.account.AHSSB257UGMQKGLZZXJ7OY23ZHQQ/ref=cm_cr_dp_d_gw_tr?ie=UTF8","Platform: PC Download, Edition: Professional","B07WSK3JS5","Platform","PC Download","Edition","Professional"
"United States",,"2022-09-26",,"allStars","https://www.amazon.com/Print-Shop-5-0-Professional-Impressive/dp/B07WSK3JS5/ref=pd_rhf_ee_s_pd_sbs_rvi_d_sccl_1_20/132-8474279-2690144?pd_rd_w=jBX3v&content-id=amzn1.sym.6640a844-ab24-4352-ac9b-78899e683a5e&pf_rd_p=6640a844-ab24-4352-ac9b-78899e683a5e&pf_rd_r=8PJF5C5K02K4NBQ02YRM&pd_rd_wg=arf7O&pd_rd_r=a4ea5dda-37ce-4956-965f-5c2a68487a3e&pd_rd_i=B07WSK3JS5&th=1","false","false","true","7",,,"B07WSK3JS5","B07WSK3JS5","1",,"when i try to run this software  it says to register it so i try and it says system cannot find the specified file or check my internet my  internet is fine i have allowed it all through my windows firewall and security nothing is working...plz give me a refund","RD5LHCN920KOD",,"One person found this helpful","junk","https://www.amazon.com/gp/customer-reviews/RD5LHCN920KOD/ref=cm_cr_dp_d_rvw_ttl?ie=UTF8&ASIN=B07WSK3JS5","Reviewed in the United States on September 26, 2022",,,"amzn1.account.AHPV2JEFN5DOWXIUIFFOEZQ5T5VQ","https://www.amazon.com/gp/profile/amzn1.account.AHPV2JEFN5DOWXIUIFFOEZQ5T5VQ/ref=cm_cr_dp_d_gw_tr?ie=UTF8","Platform: PC Download, Edition: Professional","B07WSK3JS5","Platform","PC Download","Edition","Professional"
"United States",,"2023-01-06",,"allStars","https://www.amazon.com/Print-Shop-5-0-Professional-Impressive/dp/B07WSK3JS5/ref=pd_rhf_ee_s_pd_sbs_rvi_d_sccl_1_20/132-8474279-2690144?pd_rd_w=jBX3v&content-id=amzn1.sym.6640a844-ab24-4352-ac9b-78899e683a5e&pf_rd_p=6640a844-ab24-4352-ac9b-78899e683a5e&pf_rd_r=8PJF5C5K02K4NBQ02YRM&pd_rd_wg=arf7O&pd_rd_r=a4ea5dda-37ce-4956-965f-5c2a68487a3e&pd_rd_i=B07WSK3JS5&th=1","false","false","false","8",,,"B07WSK3JS5","B07WSK3JS5","5",,"Used it for many years, it's the best value for money.  Comes with tons of free templates. Easy to install and use.","R33UZVE8XCSVK6",,,"Best card design program for the money","https://www.amazon.com/gp/customer-reviews/R33UZVE8XCSVK6/ref=cm_cr_dp_d_rvw_ttl?ie=UTF8&ASIN=B07WSK3JS5","Reviewed in the United States on January 6, 2023",,,"amzn1.account.AFBSHW4TCKWAO67CB7TDAS2WEKYA","https://www.amazon.com/gp/profile/amzn1.account.AFBSHW4TCKWAO67CB7TDAS2WEKYA/ref=cm_cr_dp_d_gw_tr?ie=UTF8","Platform: PC Download, Edition: Professional","B07WSK3JS5","Platform","PC Download","Edition","Professional"
"United States",,"2025-01-25",,"allStars","https://www.amazon.com/Greeting-Card-Factory-Deluxe-Download/dp/B0751L8GQ5/ref=pd_rhf_ee_s_pd_sbs_rvi_d_sccl_1_9/132-8474279-2690144?pd_rd_w=jBX3v&content-id=amzn1.sym.6640a844-ab24-4352-ac9b-78899e683a5e&pf_rd_p=6640a844-ab24-4352-ac9b-78899e683a5e&pf_rd_r=8PJF5C5K02K4NBQ02YRM&pd_rd_wg=arf7O&pd_rd_r=a4ea5dda-37ce-4956-965f-5c2a68487a3e&pd_rd_i=B0751L8GQ5&psc=1","false","false","true","1",,,"B0751L8GQ5","B0751L8GQ5","5",,"I love to make my own greeting cards and this program is so easy to use.  Well worth the price and the savings are great.","R39K0081KS8JFB",,"One person found this helpful","Love this product.","https://www.amazon.com/gp/customer-reviews/R39K0081KS8JFB/ref=cm_cr_dp_d_rvw_ttl?ie=UTF8&ASIN=B0751L8GQ5","Reviewed in the United States on January 25, 2025",,,"amzn1.account.AF3G6PDUZ57ENB4M2HTJENPDNLKA","https://www.amazon.com/gp/profile/amzn1.account.AF3G6PDUZ57ENB4M2HTJENPDNLKA/ref=cm_cr_dp_d_gw_tr?ie=UTF8","","B0751L8GQ5",,,,
"United States",,"2025-05-01",,"allStars","https://www.amazon.com/Greeting-Card-Factory-Deluxe-Download/dp/B0751L8GQ5/ref=pd_rhf_ee_s_pd_sbs_rvi_d_sccl_1_9/132-8474279-2690144?pd_rd_w=jBX3v&content-id=amzn1.sym.6640a844-ab24-4352-ac9b-78899e683a5e&pf_rd_p=6640a844-ab24-4352-ac9b-78899e683a5e&pf_rd_r=8PJF5C5K02K4NBQ02YRM&pd_rd_wg=arf7O&pd_rd_r=a4ea5dda-37ce-4956-965f-5c2a68487a3e&pd_rd_i=B0751L8GQ5&psc=1","false","false","true","2",,,"B0751L8GQ5","B0751L8GQ5","1",,"I had an older version of this software, loved it, but unfortunately when my computer had to be replaced I could no longer use the old version.  So I figured since I enjoyed my older version and I was comfortable with how it worked.  Why not rebuy.  Boy was I wrong!  Not user friendly anymore.  The instructions when asking how to are so blatantly comfusing. Half the function are not comparable with my printer.  It certainly was not worth the $50 I paid for it.  The download speed made no difference to me.  My old version had 5 separate discs that had to be downloaded.  This certainly is a huge downgrade from my old version.  Someone should back and compare the old to the new version to see where it all went wrong.  Would NOT recommend.","R2A169VW24ZTZR",,,"Disappointing, no very disappointing","https://www.amazon.com/gp/customer-reviews/R2A169VW24ZTZR/ref=cm_cr_dp_d_rvw_ttl?ie=UTF8&ASIN=B0751L8GQ5","Reviewed in the United States on May 1, 2025",,,"amzn1.account.AFKXKZ36QZFK7X35QAQLMOSGKNBA","https://www.amazon.com/gp/profile/amzn1.account.AFKXKZ36QZFK7X35QAQLMOSGKNBA/ref=cm_cr_dp_d_gw_tr?ie=UTF8","","B0751L8GQ5",,,,
"United States",,"2025-05-07",,"allStars","https://www.amazon.com/Greeting-Card-Factory-Deluxe-Download/dp/B0751L8GQ5/ref=pd_rhf_ee_s_pd_sbs_rvi_d_sccl_1_9/132-8474279-2690144?pd_rd_w=jBX3v&content-id=amzn1.sym.6640a844-ab24-4352-ac9b-78899e683a5e&pf_rd_p=6640a844-ab24-4352-ac9b-78899e683a5e&pf_rd_r=8PJF5C5K02K4NBQ02YRM&pd_rd_wg=arf7O&pd_rd_r=a4ea5dda-37ce-4956-965f-5c2a68487a3e&pd_rd_i=B0751L8GQ5&psc=1","false","false","true","3",,,"B0751L8GQ5","B0751L8GQ5","4",,"I have used this product over a number of years but moved away from it because I prefer making cards using borderless printing. The software I'm currently using will unfortunately be retired at the end of 2026, so I'm planning ahead. I was hoping Greeting Card Factory would offer borderless printing after all these years, but it does not. I'd really like to encourage them to include this option. I would give them 5 star if they added this feature. I do like the fact they haven't removed the purchase plan. I stay away from software that requires paying a monthly fee.","R2SS3LFXKM3B2Z",,,"Would Be Excellent If One Tweek Was Added","https://www.amazon.com/gp/customer-reviews/R2SS3LFXKM3B2Z/ref=cm_cr_dp_d_rvw_ttl?ie=UTF8&ASIN=B0751L8GQ5","Reviewed in the United States on May 7, 2025",,,"amzn1.account.AEBGX3NBFQD3FOW54DIIRZX2DURA","https://www.amazon.com/gp/profile/amzn1.account.AEBGX3NBFQD3FOW54DIIRZX2DURA/ref=cm_cr_dp_d_gw_tr?ie=UTF8","","B0751L8GQ5",,,,
"United States",,"2025-03-02",,"allStars","https://www.amazon.com/Greeting-Card-Factory-Deluxe-Download/dp/B0751L8GQ5/ref=pd_rhf_ee_s_pd_sbs_rvi_d_sccl_1_9/132-8474279-2690144?pd_rd_w=jBX3v&content-id=amzn1.sym.6640a844-ab24-4352-ac9b-78899e683a5e&pf_rd_p=6640a844-ab24-4352-ac9b-78899e683a5e&pf_rd_r=8PJF5C5K02K4NBQ02YRM&pd_rd_wg=arf7O&pd_rd_r=a4ea5dda-37ce-4956-965f-5c2a68487a3e&pd_rd_i=B0751L8GQ5&psc=1","false","false","true","4",,,"B0751L8GQ5","B0751L8GQ5","5",,"makes to most beautiful cards and stationary","R338U2KGD2GZP1",,,"card studio program","https://www.amazon.com/gp/customer-reviews/R338U2KGD2GZP1/ref=cm_cr_dp_d_rvw_ttl?ie=UTF8&ASIN=B0751L8GQ5","Reviewed in the United States on March 2, 2025",,,"amzn1.account.AEKRMI5NTZFJJMHQRZNH3CNM5KXQ","https://www.amazon.com/gp/profile/amzn1.account.AEKRMI5NTZFJJMHQRZNH3CNM5KXQ/ref=cm_cr_dp_d_gw_tr?ie=UTF8","","B0751L8GQ5",,,,
"United States",,"2025-01-19",,"allStars","https://www.amazon.com/Greeting-Card-Factory-Deluxe-Download/dp/B0751L8GQ5/ref=pd_rhf_ee_s_pd_sbs_rvi_d_sccl_1_9/132-8474279-2690144?pd_rd_w=jBX3v&content-id=amzn1.sym.6640a844-ab24-4352-ac9b-78899e683a5e&pf_rd_p=6640a844-ab24-4352-ac9b-78899e683a5e&pf_rd_r=8PJF5C5K02K4NBQ02YRM&pd_rd_wg=arf7O&pd_rd_r=a4ea5dda-37ce-4956-965f-5c2a68487a3e&pd_rd_i=B0751L8GQ5&psc=1","false","false","true","5",,,"B0751L8GQ5","B0751L8GQ5","1",,"Program works well. Have used it for years on other computers and downloaded from Nova worked fine. But this download from Amazon saves files as fsg, they won't open after being saved. That's a huge problem for me. Very disappointed.","R29OJQQLPKEFIN",,"One person found this helpful","Can't open saved files","https://www.amazon.com/gp/customer-reviews/R29OJQQLPKEFIN/ref=cm_cr_dp_d_rvw_ttl?ie=UTF8&ASIN=B0751L8GQ5","Reviewed in the United States on January 19, 2025",,,"amzn1.account.AGORQ2ISLPVUTZBSSWKQRRWKGJYQ","https://www.amazon.com/gp/profile/amzn1.account.AGORQ2ISLPVUTZBSSWKQRRWKGJYQ/ref=cm_cr_dp_d_gw_tr?ie=UTF8","","B0751L8GQ5",,,,
"United States",,"2025-02-06",,"allStars","https://www.amazon.com/Greeting-Card-Factory-Deluxe-Download/dp/B0751L8GQ5/ref=pd_rhf_ee_s_pd_sbs_rvi_d_sccl_1_9/132-8474279-2690144?pd_rd_w=jBX3v&content-id=amzn1.sym.6640a844-ab24-4352-ac9b-78899e683a5e&pf_rd_p=6640a844-ab24-4352-ac9b-78899e683a5e&pf_rd_r=8PJF5C5K02K4NBQ02YRM&pd_rd_wg=arf7O&pd_rd_r=a4ea5dda-37ce-4956-965f-5c2a68487a3e&pd_rd_i=B0751L8GQ5&psc=1","false","false","true","6",,,"B0751L8GQ5","B0751L8GQ5","5",,"Nice Christmas message","R2EKF13OUGGN2E",,,"Good quality","https://www.amazon.com/gp/customer-reviews/R2EKF13OUGGN2E/ref=cm_cr_dp_d_rvw_ttl?ie=UTF8&ASIN=B0751L8GQ5","Reviewed in the United States on February 6, 2025",,,"amzn1.account.AGDDM2E7WLMTDFG56LJOI6UEF5IQ","https://www.amazon.com/gp/profile/amzn1.account.AGDDM2E7WLMTDFG56LJOI6UEF5IQ/ref=cm_cr_dp_d_gw_tr?ie=UTF8","","B0751L8GQ5",,,,
"United States",,"2024-08-04",,"allStars","https://www.amazon.com/Greeting-Card-Factory-Deluxe-Download/dp/B0751L8GQ5/ref=pd_rhf_ee_s_pd_sbs_rvi_d_sccl_1_9/132-8474279-2690144?pd_rd_w=jBX3v&content-id=amzn1.sym.6640a844-ab24-4352-ac9b-78899e683a5e&pf_rd_p=6640a844-ab24-4352-ac9b-78899e683a5e&pf_rd_r=8PJF5C5K02K4NBQ02YRM&pd_rd_wg=arf7O&pd_rd_r=a4ea5dda-37ce-4956-965f-5c2a68487a3e&pd_rd_i=B0751L8GQ5&psc=1","false","false","true","7",,,"B0751L8GQ5","B0751L8GQ5","5",,"Ease of downloading the program.","R2M8G6MG24BY5Y",,"One person found this helpful","Easy to use","https://www.amazon.com/gp/customer-reviews/R2M8G6MG24BY5Y/ref=cm_cr_dp_d_rvw_ttl?ie=UTF8&ASIN=B0751L8GQ5","Reviewed in the United States on August 4, 2024",,,"amzn1.account.AGWGS5M4BX4LTWL27LOHOWORTW6A","https://www.amazon.com/gp/profile/amzn1.account.AGWGS5M4BX4LTWL27LOHOWORTW6A/ref=cm_cr_dp_d_gw_tr?ie=UTF8","","B0751L8GQ5",,,,
"United States",,"2023-01-27",,"allStars","https://www.amazon.com/Greeting-Card-Factory-Deluxe-Download/dp/B0751L8GQ5/ref=pd_rhf_ee_s_pd_sbs_rvi_d_sccl_1_9/132-8474279-2690144?pd_rd_w=jBX3v&content-id=amzn1.sym.6640a844-ab24-4352-ac9b-78899e683a5e&pf_rd_p=6640a844-ab24-4352-ac9b-78899e683a5e&pf_rd_r=8PJF5C5K02K4NBQ02YRM&pd_rd_wg=arf7O&pd_rd_r=a4ea5dda-37ce-4956-965f-5c2a68487a3e&pd_rd_i=B0751L8GQ5&psc=1","false","false","true","8",,,"B0751L8GQ5","B0751L8GQ5","3",,"Love my Hallmark software and thought I'd add to my options, but I've found little in this package that I'd consider using. Artwork is old fashioned and sentiments are cliched and cheesy. Sorry I paid good money for this awful package. I will stick with Hallmark.","R3OWBIPIGNDL7F",,"One person found this helpful","Designs and Texts Very Outdated","https://www.amazon.com/gp/customer-reviews/R3OWBIPIGNDL7F/ref=cm_cr_dp_d_rvw_ttl?ie=UTF8&ASIN=B0751L8GQ5","Reviewed in the United States on January 27, 2023",,,"amzn1.account.AHRILLOQMURRLMOYGRUM2PWHUU6Q","https://www.amazon.com/gp/profile/amzn1.account.AHRILLOQMURRLMOYGRUM2PWHUU6Q/ref=cm_cr_dp_d_gw_tr?ie=UTF8","","B0751L8GQ5",,,,
"United States",,"2020-11-15",,"allStars","https://www.amazon.com/Print-Shop-Professional-6-0-Download/dp/B0828NBZXC/ref=pd_rhf_ee_s_pd_sbs_rvi_d_sccl_1_18/132-8474279-2690144?pd_rd_w=jBX3v&content-id=amzn1.sym.6640a844-ab24-4352-ac9b-78899e683a5e&pf_rd_p=6640a844-ab24-4352-ac9b-78899e683a5e&pf_rd_r=8PJF5C5K02K4NBQ02YRM&pd_rd_wg=arf7O&pd_rd_r=a4ea5dda-37ce-4956-965f-5c2a68487a3e&pd_rd_i=B0828NBZXC&psc=1","false","false","true","1",,,"B0828NBZXC","B0828NBZXC","1",,"firstly-i upgraded to the professional version after the deluxe did not do what the user guide online said it did---after upgrading and installing-the software crashes constantly-the program is slow slow you wait 2-3 minutes just to view the clipart you want to insert. you cannot view the rulers and gridlines on the pages. They come and go at will. It will not print the projects most of the time. The calendar function does not work-it will not add personal events-it will not even add the US Holidays. When opening projects it will remain giving you a message that says rendering work but will not go any further until cancelling the request at which time the project opens. I have emailed customer support through broderbund-no response yet. I even questioned my computer's capability (knowing I met the requirements) had to tech guy to remote view in and watch--he told me MY COMPUTER was not the issue! This software is crap!","R3TDVOBBDUO1OZ",,"13 people found this helpful","This program is TERRIBLE","https://www.amazon.com/gp/customer-reviews/R3TDVOBBDUO1OZ/ref=cm_cr_dp_d_rvw_ttl?ie=UTF8&ASIN=B0828NBZXC","Reviewed in the United States on November 15, 2020",,,"amzn1.account.AH5SZV3G6PYHAWKOBYDZS6XPN6DA","https://www.amazon.com/gp/profile/amzn1.account.AH5SZV3G6PYHAWKOBYDZS6XPN6DA/ref=cm_cr_dp_d_gw_tr?ie=UTF8","","B0828NBZXC",,,,
"United States",,"2023-09-28",,"allStars","https://www.amazon.com/Print-Shop-Professional-6-0-Download/dp/B0828NBZXC/ref=pd_rhf_ee_s_pd_sbs_rvi_d_sccl_1_18/132-8474279-2690144?pd_rd_w=jBX3v&content-id=amzn1.sym.6640a844-ab24-4352-ac9b-78899e683a5e&pf_rd_p=6640a844-ab24-4352-ac9b-78899e683a5e&pf_rd_r=8PJF5C5K02K4NBQ02YRM&pd_rd_wg=arf7O&pd_rd_r=a4ea5dda-37ce-4956-965f-5c2a68487a3e&pd_rd_i=B0828NBZXC&psc=1","false","false","true","2",,,"B0828NBZXC","B0828NBZXC","5",,"I have used Print Shop products for years and the Professional version in specific. I find it to be able to do anything I need from business cards to websites.","R28H6T1OQ0APAE",,,"Great Destop Publishing Program","https://www.amazon.com/gp/customer-reviews/R28H6T1OQ0APAE/ref=cm_cr_dp_d_rvw_ttl?ie=UTF8&ASIN=B0828NBZXC","Reviewed in the United States on September 28, 2023",,,"amzn1.account.AEZ2QSYRB2HENYUCXOTAIHS6BKWQ","https://www.amazon.com/gp/profile/amzn1.account.AEZ2QSYRB2HENYUCXOTAIHS6BKWQ/ref=cm_cr_dp_d_gw_tr?ie=UTF8","","B0828NBZXC",,,,
"United States",,"2023-03-04",,"allStars","https://www.amazon.com/Print-Shop-Professional-6-0-Download/dp/B0828NBZXC/ref=pd_rhf_ee_s_pd_sbs_rvi_d_sccl_1_18/132-8474279-2690144?pd_rd_w=jBX3v&content-id=amzn1.sym.6640a844-ab24-4352-ac9b-78899e683a5e&pf_rd_p=6640a844-ab24-4352-ac9b-78899e683a5e&pf_rd_r=8PJF5C5K02K4NBQ02YRM&pd_rd_wg=arf7O&pd_rd_r=a4ea5dda-37ce-4956-965f-5c2a68487a3e&pd_rd_i=B0828NBZXC&psc=1","false","false","true","3",,,"B0828NBZXC","B0828NBZXC","1",,"I took 3 tries to get it to install. It takes a very long time. After the third attempt to install, it finally put the icon on the desktop. Still will not allow me to activate my license. I have been working on this installation for 5 hours and I'm still not up and running. very unhappy.as of 3/6 I’m reporting this as a fraudulent purchase. It does not activate and is absolutely USELESS. I WILL REPORT IT TO MY CREDIT CARD AS FRAUD.","R1KFYMFI66D17A",,"6 people found this helpful","Does Not Allow Activation","https://www.amazon.com/gp/customer-reviews/R1KFYMFI66D17A/ref=cm_cr_dp_d_rvw_ttl?ie=UTF8&ASIN=B0828NBZXC","Reviewed in the United States on March 4, 2023",,,"amzn1.account.AEGZRIJLEUMADSTLKH6YMSSB3THA","https://www.amazon.com/gp/profile/amzn1.account.AEGZRIJLEUMADSTLKH6YMSSB3THA/ref=cm_cr_dp_d_gw_tr?ie=UTF8","","B0828NBZXC",,,,
"United States",,"2023-03-14",,"allStars","https://www.amazon.com/Print-Shop-Professional-6-0-Download/dp/B0828NBZXC/ref=pd_rhf_ee_s_pd_sbs_rvi_d_sccl_1_18/132-8474279-2690144?pd_rd_w=jBX3v&content-id=amzn1.sym.6640a844-ab24-4352-ac9b-78899e683a5e&pf_rd_p=6640a844-ab24-4352-ac9b-78899e683a5e&pf_rd_r=8PJF5C5K02K4NBQ02YRM&pd_rd_wg=arf7O&pd_rd_r=a4ea5dda-37ce-4956-965f-5c2a68487a3e&pd_rd_i=B0828NBZXC&psc=1","false","false","false","4",,,"B0828NBZXC","B0828NBZXC","4",,"I have been using Printshop software since the olden days. (12 years or more?) It is a one time fee and you own it software so you don't have to pay every month thank god. Over the years I have had challenges when I first install it which are usually overcome if I persist, try and try again. The last time I installed I just left the PC on overnight and somehow it resolved the installation problem while I was sleeping. Anyway once you get it installed it is worth it to persist in learning any new updates. I have seen too many reviews where the reviewer claims they couldn't do something and it seems to me they just didn't want to learn a newer or updated way. I am really hooked on this software. I make greeting cards, paint party kits see photo all printed materials were made with printshop professional 5, marketing materials, and lots more. The ""my projects"" section becomes a gallery of all my photographed art works which I print out to include in craft shows application. Christmas letters and greeting cards are fun to make with this software. I tried the other really big name pricey software and was bled dry and overwhelmed by it. This software is simple and more intuitive once you get the hang of it.","R3EJYUIN4KDNBE","https://m.media-amazon.com/images/I/51pwWJ6E00L._SY88.jpg","7 people found this helpful","I've been using the affordable Printshop softwares for years and years.","https://www.amazon.com/gp/customer-reviews/R3EJYUIN4KDNBE/ref=cm_cr_dp_d_rvw_ttl?ie=UTF8&ASIN=B0828NBZXC","Reviewed in the United States on March 14, 2023",,,"amzn1.account.AH6KHG5GSIYVUVDQN2A35UG5MGVQ","https://www.amazon.com/gp/profile/amzn1.account.AH6KHG5GSIYVUVDQN2A35UG5MGVQ/ref=cm_cr_dp_d_gw_tr?ie=UTF8","","B0828NBZXC",,,,
"United States",,"2023-10-19",,"allStars","https://www.amazon.com/Print-Shop-Professional-6-0-Download/dp/B0828NBZXC/ref=pd_rhf_ee_s_pd_sbs_rvi_d_sccl_1_18/132-8474279-2690144?pd_rd_w=jBX3v&content-id=amzn1.sym.6640a844-ab24-4352-ac9b-78899e683a5e&pf_rd_p=6640a844-ab24-4352-ac9b-78899e683a5e&pf_rd_r=8PJF5C5K02K4NBQ02YRM&pd_rd_wg=arf7O&pd_rd_r=a4ea5dda-37ce-4956-965f-5c2a68487a3e&pd_rd_i=B0828NBZXC&psc=1","false","false","false","5",,,"B0828NBZXC","B0828NBZXC","5",,"I really like the program, its easy to use and comes with tons of free content that others charge for","R35XQTURYVCFJA",,,"Good selection of content, all time, best value","https://www.amazon.com/gp/customer-reviews/R35XQTURYVCFJA/ref=cm_cr_dp_d_rvw_ttl?ie=UTF8&ASIN=B0828NBZXC","Reviewed in the United States on October 19, 2023",,,"amzn1.account.AFBSHW4TCKWAO67CB7TDAS2WEKYA","https://www.amazon.com/gp/profile/amzn1.account.AFBSHW4TCKWAO67CB7TDAS2WEKYA/ref=cm_cr_dp_d_gw_tr?ie=UTF8","","B0828NBZXC",,,,
