"country","countryCode","date","filterByKeyword","filterByRating","input","isAmazonVine","isProductPageReviewFromOtherCountry","isVerified","position","product/listPrice","product/price","productAsin","productOriginalAsin","ratingScore","reviewCategoryUrl","reviewDescription","reviewId","reviewImages/0","reviewReaction","reviewTitle","reviewUrl","reviewedIn","totalCategoryRatings","totalCategoryReviews","userId","userProfileLink","variant","variantAsin","variantAttributes/0/key","variantAttributes/0/value","variantAttributes/1/key","variantAttributes/1/value"
"United States",,"2021-03-22",,"allStars","https://www.amazon.com/Print-Shop-Professional-6-0-Download/dp/B0828NBZXC/ref=pd_rhf_ee_s_pd_sbs_rvi_d_sccl_1_18/132-8474279-2690144?pd_rd_w=jBX3v&content-id=amzn1.sym.6640a844-ab24-4352-ac9b-78899e683a5e&pf_rd_p=6640a844-ab24-4352-ac9b-78899e683a5e&pf_rd_r=8PJF5C5K02K4NBQ02YRM&pd_rd_wg=arf7O&pd_rd_r=a4ea5dda-37ce-4956-965f-5c2a68487a3e&pd_rd_i=B0828NBZXC&psc=1","false","false","true","6",,,"B0828NBZXC","B0828NBZXC","1",,"It downloaded fine, but I do not like its new style.  It's harder to find images I want, and it seems that there are a lot of new images that I consider ugly or stupid.  The older version is much more user-friendly and logical.  I've used Print Shop for years, and I am very disappointed in this particular version.UPDATE!Now that I've had a chance to really get into this newer version of Print Shop, I can honestly say that I HATE IT!  I find it cumbersome, inconvenient, and slow.  Searching for an image takes an inordinate amount of time because first, you have to enter two filters (which I had to figure out how to do by myself).  Then, after your chosen category and sub-category finally load, you scroll through the pages of images.  Each page takes almost a minute to load.  Then, when you select an image, it takes more time to load.  Then, when you return to your filtered images, you end up right back on the first page, where you had started so long ago!  So, if you had progressed through to, say, page 7, now you have to ""thumb"" your way back from page 1 to where you had left off.And, let's talk about the images.  Most are ugly, in my opinion.  What happened to the nice images I used to use with my previous versions of Print Shop?  Maybe I just can't find them among all the new, stupid-looking cartoons.  All I know is that I usually cannot find what I want now.So, I was working on a project, and I wanted to do some editing of an image.  I simply wanted to change the color of the lines.  No can do!  At least, I couldn't figure out how to achieve this small task in the hour I spent trying.  Then, I wanted to add some color to some cells on a calendar page.  I was able to achieve that, however, at one point, the program just stopped letting me access the editing feature.  Just stopped.  I couldn't do anything more to my calendar page.Now, I have a brand new HP Pavilion computer with Windows 10.  It is a fantastic computer...lots more storage capacity than any other computer I have used at home and at work.  And it's FAST!  I also have Xfinity High Speed Wireless service.  So, I know the issues I'm having with this version of Print Shop have nothing to do with my computer or Internet service!BOTTOM LINE!  Since returns are not allowed, I will be looking for a different program to meet my desktop publishing needs.  I am done with Print Shop!  Any ideas out there?  I would love to know what other programs folks are using and really like!","R3R180VL78HRRD",,"18 people found this helpful","I don't like it. AT. ALL.","https://www.amazon.com/gp/customer-reviews/R3R180VL78HRRD/ref=cm_cr_dp_d_rvw_ttl?ie=UTF8&ASIN=B0828NBZXC","Reviewed in the United States on March 22, 2021",,,"amzn1.account.AEJYZOXX6STVGBZKWYW2PPZ7YYTA","https://www.amazon.com/gp/profile/amzn1.account.AEJYZOXX6STVGBZKWYW2PPZ7YYTA/ref=cm_cr_dp_d_gw_tr?ie=UTF8","","B0828NBZXC",,,,
"United States",,"2023-04-26",,"allStars","https://www.amazon.com/Print-Shop-Professional-6-0-Download/dp/B0828NBZXC/ref=pd_rhf_ee_s_pd_sbs_rvi_d_sccl_1_18/132-8474279-2690144?pd_rd_w=jBX3v&content-id=amzn1.sym.6640a844-ab24-4352-ac9b-78899e683a5e&pf_rd_p=6640a844-ab24-4352-ac9b-78899e683a5e&pf_rd_r=8PJF5C5K02K4NBQ02YRM&pd_rd_wg=arf7O&pd_rd_r=a4ea5dda-37ce-4956-965f-5c2a68487a3e&pd_rd_i=B0828NBZXC&psc=1","false","false","true","7",,,"B0828NBZXC","B0828NBZXC","1",,"I was able to download and install without a problem. The activation key provided does not work. Amazon told me to contact the manufacturer and the manufacturer has yet to provide a valid activation key. They initially responded to ask for the activation key provided through Amazon. I provided that to them and that was 3 days ago. I have not received any further assistance from the manufacturer. I have a digital product that is basically useless.","R1LUAHBBSXHCJU",,"3 people found this helpful","Activation Key Invalid","https://www.amazon.com/gp/customer-reviews/R1LUAHBBSXHCJU/ref=cm_cr_dp_d_rvw_ttl?ie=UTF8&ASIN=B0828NBZXC","Reviewed in the United States on April 26, 2023",,,"amzn1.account.AHTJCLVMBUHPIQKOM62RK7VONPOA","https://www.amazon.com/gp/profile/amzn1.account.AHTJCLVMBUHPIQKOM62RK7VONPOA/ref=cm_cr_dp_d_gw_tr?ie=UTF8","","B0828NBZXC",,,,
"United States",,"2023-05-14",,"allStars","https://www.amazon.com/Print-Shop-Professional-6-0-Download/dp/B0828NBZXC/ref=pd_rhf_ee_s_pd_sbs_rvi_d_sccl_1_18/132-8474279-2690144?pd_rd_w=jBX3v&content-id=amzn1.sym.6640a844-ab24-4352-ac9b-78899e683a5e&pf_rd_p=6640a844-ab24-4352-ac9b-78899e683a5e&pf_rd_r=8PJF5C5K02K4NBQ02YRM&pd_rd_wg=arf7O&pd_rd_r=a4ea5dda-37ce-4956-965f-5c2a68487a3e&pd_rd_i=B0828NBZXC&psc=1","false","false","true","8",,,"B0828NBZXC","B0828NBZXC","1",,"I have wasted nearly 6 hours trying to get this stupid software to activate. Still no results. It is impossible to contact Amazon Customer Service to rectify this problem, this totally sucks.","RZ88HXXU89LFO",,"2 people found this helpful","Software will not activate. Total stressor.","https://www.amazon.com/gp/customer-reviews/RZ88HXXU89LFO/ref=cm_cr_dp_d_rvw_ttl?ie=UTF8&ASIN=B0828NBZXC","Reviewed in the United States on May 14, 2023",,,"amzn1.account.AE2S5JD34ZLSZW3PDCZVMFQQMWOA","https://www.amazon.com/gp/profile/amzn1.account.AE2S5JD34ZLSZW3PDCZVMFQQMWOA/ref=cm_cr_dp_d_gw_tr?ie=UTF8","","B0828NBZXC",,,,
"United States",,"2025-01-08",,"allStars","https://www.amazon.com/PrintMaster-Platinum-Mac-Personalized-Scrapbooks/dp/B0157GSWUQ/ref=pd_rhf_ee_s_pd_sbs_rvi_d_sccl_1_8/132-8474279-2690144?pd_rd_w=jBX3v&content-id=amzn1.sym.6640a844-ab24-4352-ac9b-78899e683a5e&pf_rd_p=6640a844-ab24-4352-ac9b-78899e683a5e&pf_rd_r=8PJF5C5K02K4NBQ02YRM&pd_rd_wg=arf7O&pd_rd_r=a4ea5dda-37ce-4956-965f-5c2a68487a3e&pd_rd_i=B0157GSWUQ&psc=1","false","false","true","1",,,"B0157GSWUQ","B0157GSWUQ","1",,"I was looking forward to using this PrintMaster V7 on my Mac Desktop for card making however, it did not download.  I purchased the product that had Instant Download rather than software that required mail, thinking it would be easy and quick on my computer.  I am very disappointed as I paid full price for this software, which is not usable on my desktop Mac.","R1H986JATR2H6Q",,,"Not able to download on my Mac desktop","https://www.amazon.com/gp/customer-reviews/R1H986JATR2H6Q/ref=cm_cr_dp_d_rvw_ttl?ie=UTF8&ASIN=B0157GSWUQ","Reviewed in the United States on January 8, 2025",,,"amzn1.account.AFLNR3TLAZEDBTWD7EHSXV3P2X2A","https://www.amazon.com/gp/profile/amzn1.account.AFLNR3TLAZEDBTWD7EHSXV3P2X2A/ref=cm_cr_dp_d_gw_tr?ie=UTF8","","B0157GSWUQ",,,,
"United States",,"2025-01-06",,"allStars","https://www.amazon.com/PrintMaster-Platinum-Mac-Personalized-Scrapbooks/dp/B0157GSWUQ/ref=pd_rhf_ee_s_pd_sbs_rvi_d_sccl_1_8/132-8474279-2690144?pd_rd_w=jBX3v&content-id=amzn1.sym.6640a844-ab24-4352-ac9b-78899e683a5e&pf_rd_p=6640a844-ab24-4352-ac9b-78899e683a5e&pf_rd_r=8PJF5C5K02K4NBQ02YRM&pd_rd_wg=arf7O&pd_rd_r=a4ea5dda-37ce-4956-965f-5c2a68487a3e&pd_rd_i=B0157GSWUQ&psc=1","false","false","true","2",,,"B0157GSWUQ","B0157GSWUQ","1",,"I am frustrated that the software I ordered is not compatible with my Macbook air.  I specifically looked at products that are Mac friendly.  I did not have any idea that the software was not compatible until I tried to download it.  It will download but not install.  I would like a refund!!","RHL9ECN5P96U0",,,"This software is not compatible with my Mac.","https://www.amazon.com/gp/customer-reviews/RHL9ECN5P96U0/ref=cm_cr_dp_d_rvw_ttl?ie=UTF8&ASIN=B0157GSWUQ","Reviewed in the United States on January 6, 2025",,,"amzn1.account.AHXOB5A2OUGABSISVRHT5N3237RQ","https://www.amazon.com/gp/profile/amzn1.account.AHXOB5A2OUGABSISVRHT5N3237RQ/ref=cm_cr_dp_d_gw_tr?ie=UTF8","","B0157GSWUQ",,,,
"United States",,"2019-11-17",,"allStars","https://www.amazon.com/PrintMaster-Platinum-Mac-Personalized-Scrapbooks/dp/B0157GSWUQ/ref=pd_rhf_ee_s_pd_sbs_rvi_d_sccl_1_8/132-8474279-2690144?pd_rd_w=jBX3v&content-id=amzn1.sym.6640a844-ab24-4352-ac9b-78899e683a5e&pf_rd_p=6640a844-ab24-4352-ac9b-78899e683a5e&pf_rd_r=8PJF5C5K02K4NBQ02YRM&pd_rd_wg=arf7O&pd_rd_r=a4ea5dda-37ce-4956-965f-5c2a68487a3e&pd_rd_i=B0157GSWUQ&psc=1","false","false","true","3",,,"B0157GSWUQ","B0157GSWUQ","3",,"I have always had a mac and have been using Broaderbund's Printmaster products for many years to create simple invitations, cards, flyers for work, etc.  Nothing too fancy, and typically an easy program to work with if you're not a graphic designer and don't want to spend a lot of money.While their early products, originally discs, compatible with both PC's and Macs, were quirky at times on macs, they did the job.As computers and programming have become more complicated, current PrintMaster products, are increasingly less compatible nor stable on today's Macs.  Yes, even the v7 - which I purchased from this outside seller and have kept - works ""good enough"" - but certain features can't be opened.  (I had hoped to upgrade to the v8, prior to settling for the v7, which I'd purchased directly from Broaderbund and had to return. Total mess!). The Broaderbund customer service folks were kind enough to refund and I know their programmers are working on the Mac compatibility issues.  Not there as of this writing, I'm afraid.","R27D7QY066VHV5",,"3 people found this helpful","Not good with Macs","https://www.amazon.com/gp/customer-reviews/R27D7QY066VHV5/ref=cm_cr_dp_d_rvw_ttl?ie=UTF8&ASIN=B0157GSWUQ","Reviewed in the United States on November 17, 2019",,,"amzn1.account.AGYJ4WP6YENPCLPVOV2UU5DBINTQ","https://www.amazon.com/gp/profile/amzn1.account.AGYJ4WP6YENPCLPVOV2UU5DBINTQ/ref=cm_cr_dp_d_gw_tr?ie=UTF8","","B0157GSWUQ",,,,
"United States",,"2017-10-03",,"allStars","https://www.amazon.com/PrintMaster-Platinum-Mac-Personalized-Scrapbooks/dp/B0157GSWUQ/ref=pd_rhf_ee_s_pd_sbs_rvi_d_sccl_1_8/132-8474279-2690144?pd_rd_w=jBX3v&content-id=amzn1.sym.6640a844-ab24-4352-ac9b-78899e683a5e&pf_rd_p=6640a844-ab24-4352-ac9b-78899e683a5e&pf_rd_r=8PJF5C5K02K4NBQ02YRM&pd_rd_wg=arf7O&pd_rd_r=a4ea5dda-37ce-4956-965f-5c2a68487a3e&pd_rd_i=B0157GSWUQ&psc=1","false","false","true","4",,,"B0157GSWUQ","B0157GSWUQ","5",,"I enjoy the print master program. There’s tons to do with it. As a teacher I can make cute fliers and notes home to parents. I also like it for my folder covers and name tags. Get a great printer because you’ll be printing a lot. There’s a lot of opportunities to be creative and make one of a kind things with this program. I spend way too much time on it.","R2PN8Z3S1HIC7B",,"One person found this helpful","Excellent for Teachers","https://www.amazon.com/gp/customer-reviews/R2PN8Z3S1HIC7B/ref=cm_cr_dp_d_rvw_ttl?ie=UTF8&ASIN=B0157GSWUQ","Reviewed in the United States on October 3, 2017",,,"amzn1.account.AHNHUPTQX5NACQSBIP74YWLKK24Q","https://www.amazon.com/gp/profile/amzn1.account.AHNHUPTQX5NACQSBIP74YWLKK24Q/ref=cm_cr_dp_d_gw_tr?ie=UTF8","","B0157GSWUQ",,,,
"United States",,"2023-06-14",,"allStars","https://www.amazon.com/PrintMaster-Platinum-Mac-Personalized-Scrapbooks/dp/B0157GSWUQ/ref=pd_rhf_ee_s_pd_sbs_rvi_d_sccl_1_8/132-8474279-2690144?pd_rd_w=jBX3v&content-id=amzn1.sym.6640a844-ab24-4352-ac9b-78899e683a5e&pf_rd_p=6640a844-ab24-4352-ac9b-78899e683a5e&pf_rd_r=8PJF5C5K02K4NBQ02YRM&pd_rd_wg=arf7O&pd_rd_r=a4ea5dda-37ce-4956-965f-5c2a68487a3e&pd_rd_i=B0157GSWUQ&psc=1","false","false","true","5",,,"B0157GSWUQ","B0157GSWUQ","1",,"Wasted $40. No refunds. The program will not download as a normal user. It requires you to logout and then login by becoming the “root user” a super user that has the ability to change anything on your computer. That’s bad news as it can open your computer to hackers if you keep it open. Root user is a not meant for normal use. I tried it to see if it downloaded and it did but I quickly just logged out and disabled the root user. I wish there was a way to share it to my normal user but so far there’s no way to do that.","RVNB7RWKIRDWW",,,"MONEY WASTED. DONT BUY FOR MAC","https://www.amazon.com/gp/customer-reviews/RVNB7RWKIRDWW/ref=cm_cr_dp_d_rvw_ttl?ie=UTF8&ASIN=B0157GSWUQ","Reviewed in the United States on June 14, 2023",,,"amzn1.account.AGGEACJZEXO2NSCQJJLCZMVOR5PQ","https://www.amazon.com/gp/profile/amzn1.account.AGGEACJZEXO2NSCQJJLCZMVOR5PQ/ref=cm_cr_dp_d_gw_tr?ie=UTF8","","B0157GSWUQ",,,,
"United States",,"2017-01-22",,"allStars","https://www.amazon.com/PrintMaster-Platinum-Mac-Personalized-Scrapbooks/dp/B0157GSWUQ/ref=pd_rhf_ee_s_pd_sbs_rvi_d_sccl_1_8/132-8474279-2690144?pd_rd_w=jBX3v&content-id=amzn1.sym.6640a844-ab24-4352-ac9b-78899e683a5e&pf_rd_p=6640a844-ab24-4352-ac9b-78899e683a5e&pf_rd_r=8PJF5C5K02K4NBQ02YRM&pd_rd_wg=arf7O&pd_rd_r=a4ea5dda-37ce-4956-965f-5c2a68487a3e&pd_rd_i=B0157GSWUQ&psc=1","false","false","true","6",,,"B0157GSWUQ","B0157GSWUQ","1",,"I am really, really disappointed with this program. I have been using Printmaster 17 then 18 for years and needed a version for my MacBook. This program is not responsive and difficult to use. It would not let me copy and paste sentences I needed to move and then when I went to print my postcard creation, it would not let me print 4 of them on a page. I would have had to print out one at time. Like it said, I have been using Printmaster software for about 15 years so the lack of ease of use has come as a VERY big surprise. I would very much like to return this product and get my money back ... sorry, but it is so not worth it. I am very disappointed and frustrated!","RUTGZMRBQ45GJ",,"7 people found this helpful","really disappointed with this program","https://www.amazon.com/gp/customer-reviews/RUTGZMRBQ45GJ/ref=cm_cr_dp_d_rvw_ttl?ie=UTF8&ASIN=B0157GSWUQ","Reviewed in the United States on January 22, 2017",,,"amzn1.account.AEKCQW3BEKQAJTC5RIMWWYFXJLMQ","https://www.amazon.com/gp/profile/amzn1.account.AEKCQW3BEKQAJTC5RIMWWYFXJLMQ/ref=cm_cr_dp_d_gw_tr?ie=UTF8","","B0157GSWUQ",,,,
"United States",,"2022-12-20",,"allStars","https://www.amazon.com/PrintMaster-Platinum-Mac-Personalized-Scrapbooks/dp/B0157GSWUQ/ref=pd_rhf_ee_s_pd_sbs_rvi_d_sccl_1_8/132-8474279-2690144?pd_rd_w=jBX3v&content-id=amzn1.sym.6640a844-ab24-4352-ac9b-78899e683a5e&pf_rd_p=6640a844-ab24-4352-ac9b-78899e683a5e&pf_rd_r=8PJF5C5K02K4NBQ02YRM&pd_rd_wg=arf7O&pd_rd_r=a4ea5dda-37ce-4956-965f-5c2a68487a3e&pd_rd_i=B0157GSWUQ&psc=1","false","false","true","7",,,"B0157GSWUQ","B0157GSWUQ","1",,"I purchased another PrintMaster software download today after being told I could use the previous download from my other computer to my new one. I get a message that the :root: needs to install. I called Apple and cannot do that in chance that it would corrupt my new computer. I tried to call Customer service 4 times. After a series of answer a stupid robot to get to the right place I was asked for a pin (4 times). Each time I put the pin in they disconnected the call. Do not purchase this software, it is a hoax!","R2G1ZTGLOR8VG1",,,"Can't give a star value","https://www.amazon.com/gp/customer-reviews/R2G1ZTGLOR8VG1/ref=cm_cr_dp_d_rvw_ttl?ie=UTF8&ASIN=B0157GSWUQ","Reviewed in the United States on December 20, 2022",,,"amzn1.account.AEQY2KJIXD6ARLLIITHGVYBECRLQ","https://www.amazon.com/gp/profile/amzn1.account.AEQY2KJIXD6ARLLIITHGVYBECRLQ/ref=cm_cr_dp_d_gw_tr?ie=UTF8","","B0157GSWUQ",,,,
"United States",,"2021-01-15",,"allStars","https://www.amazon.com/PrintMaster-Platinum-Mac-Personalized-Scrapbooks/dp/B0157GSWUQ/ref=pd_rhf_ee_s_pd_sbs_rvi_d_sccl_1_8/132-8474279-2690144?pd_rd_w=jBX3v&content-id=amzn1.sym.6640a844-ab24-4352-ac9b-78899e683a5e&pf_rd_p=6640a844-ab24-4352-ac9b-78899e683a5e&pf_rd_r=8PJF5C5K02K4NBQ02YRM&pd_rd_wg=arf7O&pd_rd_r=a4ea5dda-37ce-4956-965f-5c2a68487a3e&pd_rd_i=B0157GSWUQ&psc=1","false","false","true","8",,,"B0157GSWUQ","B0157GSWUQ","3",,"To some time to download!","R3I3PJPPROG1M1",,,"Ok","https://www.amazon.com/gp/customer-reviews/R3I3PJPPROG1M1/ref=cm_cr_dp_d_rvw_ttl?ie=UTF8&ASIN=B0157GSWUQ","Reviewed in the United States on January 15, 2021",,,"amzn1.account.AHQ4CNU3Q3HOJM27FQIYNV6WMMGQ","https://www.amazon.com/gp/profile/amzn1.account.AHQ4CNU3Q3HOJM27FQIYNV6WMMGQ/ref=cm_cr_dp_d_gw_tr?ie=UTF8","","B0157GSWUQ",,,,
"United States",,"2025-05-15",,"allStars","https://www.amazon.com/PrintMaster-v8-Platinum-PC-Download/dp/B07XW27GDY/ref=pd_rhf_ee_s_pd_sbs_rvi_d_sccl_1_10/132-8474279-2690144?pd_rd_w=jBX3v&content-id=amzn1.sym.6640a844-ab24-4352-ac9b-78899e683a5e&pf_rd_p=6640a844-ab24-4352-ac9b-78899e683a5e&pf_rd_r=8PJF5C5K02K4NBQ02YRM&pd_rd_wg=arf7O&pd_rd_r=a4ea5dda-37ce-4956-965f-5c2a68487a3e&pd_rd_i=B07XW27GDY&psc=1","false","false","true","1",,,"B07XW27GDY","B07XW27GDY","5",,"I purchased Print master to replace an older model which would not load on my new computer.  My new computer runs Windows 11 Pro and loaded Print Master Platinum 8 with no problem and runs better than the older version.  The only problem is that all the files on the older disk version are not accessible to the new down loaded version.  The new version that I purchased offers easier operation and is very user friendly.  The User's Manual is included in the download and is printable.  It is much improved over the older version (Print Master Deluxe 7.0).  I would recommend it to anyone looking for a good print program.","R2O1SPONIY3V96",,,"Works great with Windows 11 Pro","https://www.amazon.com/gp/customer-reviews/R2O1SPONIY3V96/ref=cm_cr_dp_d_rvw_ttl?ie=UTF8&ASIN=B07XW27GDY","Reviewed in the United States on May 15, 2025",,,"amzn1.account.AEZ5A5LGNLT77WW2VJIHH4IU3BNQ","https://www.amazon.com/gp/profile/amzn1.account.AEZ5A5LGNLT77WW2VJIHH4IU3BNQ/ref=cm_cr_dp_d_gw_tr?ie=UTF8","","B07XW27GDY",,,,
"United States",,"2025-02-15",,"allStars","https://www.amazon.com/PrintMaster-v8-Platinum-PC-Download/dp/B07XW27GDY/ref=pd_rhf_ee_s_pd_sbs_rvi_d_sccl_1_10/132-8474279-2690144?pd_rd_w=jBX3v&content-id=amzn1.sym.6640a844-ab24-4352-ac9b-78899e683a5e&pf_rd_p=6640a844-ab24-4352-ac9b-78899e683a5e&pf_rd_r=8PJF5C5K02K4NBQ02YRM&pd_rd_wg=arf7O&pd_rd_r=a4ea5dda-37ce-4956-965f-5c2a68487a3e&pd_rd_i=B07XW27GDY&psc=1","false","false","true","2",,,"B07XW27GDY","B07XW27GDY","1",,"Well this is my third PrintMaster I've owned. My last one was PrintMaster 18.1 and I will tell you this - the programmer's have made a huge step backward. Although the interface is changed the functionality is greatly diminished. The old version had so many extra's with the creations you make from scratch that it was unbelievable. This version has so many issues: No more drag and drop or copy and paste pictures, very limited shapes for texts, incredibly cumbersome with just about every function you use. If the the companies idea was to streamline the program they missed the boat entirely. I believe what they were trying to do was create a program where it was simpler to just make a card or letterhead from a template and even that is twice as difficult. I've been using PrintMaster for at least 20 years and I will tell that for $40 bucks I guess it will do the job if you have the time and patience to click here, drag there etc., etc. and that's my 2 cents worth.","R9RT8VKXGWFTH",,"10 people found this helpful","My 2 cent's worth -","https://www.amazon.com/gp/customer-reviews/R9RT8VKXGWFTH/ref=cm_cr_dp_d_rvw_ttl?ie=UTF8&ASIN=B07XW27GDY","Reviewed in the United States on February 15, 2025",,,"amzn1.account.AES67GSDKJ5G2GSVRRXXUDT5ETLA","https://www.amazon.com/gp/profile/amzn1.account.AES67GSDKJ5G2GSVRRXXUDT5ETLA/ref=cm_cr_dp_d_gw_tr?ie=UTF8","","B07XW27GDY",,,,
"United States",,"2025-03-14",,"allStars","https://www.amazon.com/PrintMaster-v8-Platinum-PC-Download/dp/B07XW27GDY/ref=pd_rhf_ee_s_pd_sbs_rvi_d_sccl_1_10/132-8474279-2690144?pd_rd_w=jBX3v&content-id=amzn1.sym.6640a844-ab24-4352-ac9b-78899e683a5e&pf_rd_p=6640a844-ab24-4352-ac9b-78899e683a5e&pf_rd_r=8PJF5C5K02K4NBQ02YRM&pd_rd_wg=arf7O&pd_rd_r=a4ea5dda-37ce-4956-965f-5c2a68487a3e&pd_rd_i=B07XW27GDY&psc=1","false","false","true","3",,,"B07XW27GDY","B07XW27GDY","5",,"I love the projects I can do easily. It's not quite as intuitive as the previous edition, but I'm learning.","R2OIHHEZD26KJY",,,"Good for home projects, invitations, etc.","https://www.amazon.com/gp/customer-reviews/R2OIHHEZD26KJY/ref=cm_cr_dp_d_rvw_ttl?ie=UTF8&ASIN=B07XW27GDY","Reviewed in the United States on March 14, 2025",,,"amzn1.account.AFPO22LFWAKLT55LCKW5IAX3FTMA","https://www.amazon.com/gp/profile/amzn1.account.AFPO22LFWAKLT55LCKW5IAX3FTMA/ref=cm_cr_dp_d_gw_tr?ie=UTF8","","B07XW27GDY",,,,
"United States",,"2025-05-23",,"allStars","https://www.amazon.com/PrintMaster-v8-Platinum-PC-Download/dp/B07XW27GDY/ref=pd_rhf_ee_s_pd_sbs_rvi_d_sccl_1_10/132-8474279-2690144?pd_rd_w=jBX3v&content-id=amzn1.sym.6640a844-ab24-4352-ac9b-78899e683a5e&pf_rd_p=6640a844-ab24-4352-ac9b-78899e683a5e&pf_rd_r=8PJF5C5K02K4NBQ02YRM&pd_rd_wg=arf7O&pd_rd_r=a4ea5dda-37ce-4956-965f-5c2a68487a3e&pd_rd_i=B07XW27GDY&psc=1","false","false","true","4",,,"B07XW27GDY","B07XW27GDY","4",,"A little complicated from Printshop.I'm getting it!!!","R2IIYJA94KVLDD",,,"I'm getting it!","https://www.amazon.com/gp/customer-reviews/R2IIYJA94KVLDD/ref=cm_cr_dp_d_rvw_ttl?ie=UTF8&ASIN=B07XW27GDY","Reviewed in the United States on May 23, 2025",,,"amzn1.account.AEDTO6MRZZFXOESCCQDOIEWFT6YQ","https://www.amazon.com/gp/profile/amzn1.account.AEDTO6MRZZFXOESCCQDOIEWFT6YQ/ref=cm_cr_dp_d_gw_tr?ie=UTF8","","B07XW27GDY",,,,
"United States",,"2025-01-10",,"allStars","https://www.amazon.com/PrintMaster-v8-Platinum-PC-Download/dp/B07XW27GDY/ref=pd_rhf_ee_s_pd_sbs_rvi_d_sccl_1_10/132-8474279-2690144?pd_rd_w=jBX3v&content-id=amzn1.sym.6640a844-ab24-4352-ac9b-78899e683a5e&pf_rd_p=6640a844-ab24-4352-ac9b-78899e683a5e&pf_rd_r=8PJF5C5K02K4NBQ02YRM&pd_rd_wg=arf7O&pd_rd_r=a4ea5dda-37ce-4956-965f-5c2a68487a3e&pd_rd_i=B07XW27GDY&psc=1","false","false","true","5",,,"B07XW27GDY","B07XW27GDY","5",,"I use this product  often it is how I do greetings it super","R9F49IZWXSG56",,,"Works great","https://www.amazon.com/gp/customer-reviews/R9F49IZWXSG56/ref=cm_cr_dp_d_rvw_ttl?ie=UTF8&ASIN=B07XW27GDY","Reviewed in the United States on January 10, 2025",,,"amzn1.account.AFT7M4Z43HMJMAAPBQQCCIDKJGAQ","https://www.amazon.com/gp/profile/amzn1.account.AFT7M4Z43HMJMAAPBQQCCIDKJGAQ/ref=cm_cr_dp_d_gw_tr?ie=UTF8","","B07XW27GDY",,,,
"United States",,"2025-05-08",,"allStars","https://www.amazon.com/PrintMaster-v8-Platinum-PC-Download/dp/B07XW27GDY/ref=pd_rhf_ee_s_pd_sbs_rvi_d_sccl_1_10/132-8474279-2690144?pd_rd_w=jBX3v&content-id=amzn1.sym.6640a844-ab24-4352-ac9b-78899e683a5e&pf_rd_p=6640a844-ab24-4352-ac9b-78899e683a5e&pf_rd_r=8PJF5C5K02K4NBQ02YRM&pd_rd_wg=arf7O&pd_rd_r=a4ea5dda-37ce-4956-965f-5c2a68487a3e&pd_rd_i=B07XW27GDY&psc=1","false","false","true","6",,,"B07XW27GDY","B07XW27GDY","1",,"This software is non refundable.  Be careful. I purchased it and do not know how to use it. There are no instructions or tutorials.  I wasted money. Maybe other tech savvy people would know how to operate this program. Highly disappointed on Amazon.","RG8R2JK34WE2E",,,"Product with no instructions on how to use b it","https://www.amazon.com/gp/customer-reviews/RG8R2JK34WE2E/ref=cm_cr_dp_d_rvw_ttl?ie=UTF8&ASIN=B07XW27GDY","Reviewed in the United States on May 8, 2025",,,"amzn1.account.AFBUCW3CYUKESW5KXD7NIEFUGE3A","https://www.amazon.com/gp/profile/amzn1.account.AFBUCW3CYUKESW5KXD7NIEFUGE3A/ref=cm_cr_dp_d_gw_tr?ie=UTF8","","B07XW27GDY",,,,
"United States",,"2025-05-04",,"allStars","https://www.amazon.com/PrintMaster-v8-Platinum-PC-Download/dp/B07XW27GDY/ref=pd_rhf_ee_s_pd_sbs_rvi_d_sccl_1_10/132-8474279-2690144?pd_rd_w=jBX3v&content-id=amzn1.sym.6640a844-ab24-4352-ac9b-78899e683a5e&pf_rd_p=6640a844-ab24-4352-ac9b-78899e683a5e&pf_rd_r=8PJF5C5K02K4NBQ02YRM&pd_rd_wg=arf7O&pd_rd_r=a4ea5dda-37ce-4956-965f-5c2a68487a3e&pd_rd_i=B07XW27GDY&psc=1","false","false","true","7",,,"B07XW27GDY","B07XW27GDY","2",,"I just bought a new PC with Windows 11.  I have been using for YEARS, Printmaster 11.  When I purchased Platinum, it worked with Windows 11 but looks very different than the older versions.  THE BIG PROBLEM:  Platinum does not work with any of the older versions of Printmaster.  All of my saved Printmaster 11 projects would NOT open.SOLUTION: I was able to download Printmaster 11 onto Windows 11 without any problems.  Then I had to find the app file within Windows 11 so every time I open one of my projects it would just open.  It all works just fine with Printmaster 11 - NOT Platinum.","R168VEFQS4QT20",,,"Platinum DOES NOT work with older saved Printmaster Files (like Printmaster 11)","https://www.amazon.com/gp/customer-reviews/R168VEFQS4QT20/ref=cm_cr_dp_d_rvw_ttl?ie=UTF8&ASIN=B07XW27GDY","Reviewed in the United States on May 4, 2025",,,"amzn1.account.AF5CN6COYNNJ5PZ5U6TLXYC3P6OQ","https://www.amazon.com/gp/profile/amzn1.account.AF5CN6COYNNJ5PZ5U6TLXYC3P6OQ/ref=cm_cr_dp_d_gw_tr?ie=UTF8","","B07XW27GDY",,,,
